Tweet_Id,Time_Of_Tweet,User_ID,Tweet_Text
1276441326263758848,2020-06-26 09:05:01,125709367,Current Silver spot price     silver gold silverprice goldprice            
1276432557106696193,2020-06-26 08:30:11,1158082361646620674, gold mine  information The gold price was       USD per             UTC goldprice gold price quote 
1276427616405331968,2020-06-26 08:10:33,48728926,The spot gold price from has gone  through     toz        toz goldprice chart Sign  and get free email alerts when the spot price hits your chosen values 
1276425741970870273,2020-06-26 08:03:06,1001192245, Gold Price Forecast   High Back  Radar RSI Eyes Overbought Zone GLD 
1276424468521459712,2020-06-26 07:58:02,1919373924,Gold prices are trading rather muted  Thursday after the previous strong price action learnwithorbex orbex  marketinsights orbex daily Forex  Trading Intraday XAUUSD gold 
1276423190802239488,2020-06-26 07:52:58,1256192328412418052, ForexAnalysis Gold price rallied   new multi year high above     before correcting lower Crude oil price  currently recovering from     but   facing many hurdles Important Takeaways for Gold and Oil XTIUSD GOLD trading forex 
1276423102847647745,2020-06-26 07:52:37,253971576, ForexAnalysis Gold price rallied   new multi year high above     before correcting lower Crude oil price  currently recovering from     but   facing many hurdles Important Takeaways for Gold and Oil XTIUSD GOLD trading forex 
1276423017111990274,2020-06-26 07:52:16,899661698335944704,GCQ  the active Comex gold future  trading   premium       above the spot OTC loco London gold price 
1276421024188256256,2020-06-26 07:44:21,3426230833,Today gold price increase and silver price  less  India 
1276420431306776576,2020-06-26 07:42:00,2806642239,After shooting last round  ammo Centralbank will  unarmed  deal with ensuing crash leaving fiscal policy unable  deal with market crash amp austerity Will  suffer hyperinflation gold commodity price hikes austerity starvation martial law digital SurveillanceState
1276420160182792192,2020-06-26 07:40:55,1190224926764142593,Technical Overview XAUUSD The rise  Asian stocks knocks off Gold Technically the price trades within familiar ranges within  potential symmetrical triangle pattern  the hourly chart  break above      needed for the further upside 
1276417505322348551,2020-06-26 07:30:22,472488467,London Gold Price Open     USD per              BST
1276411894086189057,2020-06-26 07:08:04,58446688,The spot gold price from has gone  through     toz        toz goldprice chart Sign  and get free email alerts when the spot price hits your chosen values 
1276407867663241216,2020-06-26 06:52:04,2433277862,Gold Rate  India Today   June     amp   Carat Gold Price gold goldrate goldprice 
1276401614174240770,2020-06-26 06:27:13,70641893,Zurich Gold Price Open     USD per              CEST 
1276397221261516800,2020-06-26 06:09:46,1227624730770972673,Price target MCT     GOLD 
1276394877287202818,2020-06-26 06:00:27,472488467,Zurich Gold Price Open     USD per              CEST
1276394769414045696,2020-06-26 06:00:01,827530786253344773,The Price  Gold  Moving Fast AVATRADE itisis avatrade italy italian exclusive trade real international gold play bitcoin cryptocurrency digitalmarketing love essentials gaming billionaire greatness amp amp 
1276391363169316869,2020-06-26 05:46:29,1270318362191515648,Today  gold and silver price   June   Bsk jewellers visit your nearest show room gold silver goldprice goldpricetoday hyderabad khammam warangal karimnagar goldjewelry jewelry jewellery 
1276391209666142208,2020-06-26 05:45:53,1127312545243717632, Gold price  track for third weekly gain  virus cases surge 
1276391020578500608,2020-06-26 05:45:08,329747118,Canaccord says Bellevue Gold ticking all the boxes   lifts price target      Deep Value Resources Rising Stars BGL resources gold investment 
1276386646238298113,2020-06-26 05:27:45,58446688,The spot gold price from has gone down through     toz        toz goldprice chart Sign  and get free email alerts when the spot price hits your chosen values 
1276385758144630785,2020-06-26 05:24:13,2357679170,Click below  see  weekly Gold price prediction  the Pynk Beta Comment below  tell  your prediction CrowdWisdom XAUUSD XAU  Fintech artificialintelligence via 
1276379755743342593,2020-06-26 05:00:22,472488467,Sydney Gold Price Close     USD per              EST
1276376559687856131,2020-06-26 04:47:40,68927629,India Gold August Futures eased following positive trend  equity markets but rise  COVID  cases  likely  support safe haven buying suggest experts  
1276373250470105090,2020-06-26 04:34:31,2931705480,   the only fanboy  fintwit Here  your amateur chart FYI Nice  move imminent breakout  trend then perfect back test regardless  gold price  lack  any exploration news Please send   hat   gold gold japan 
1276372206377828352,2020-06-26 04:30:22,472488467,Hong Kong Gold Price Morning Session Close     USD per              HKT
1276368496826310658,2020-06-26 04:15:38,18921618,The price  gold was unchanged  morning trade  Friday June   the Gold Traders Association reported gold price TheNationThailand 
1276365048097779712,2020-06-26 04:01:55,48728926,The spot gold price from has gone down through     toz        toz goldprice chart Sign  and get free email alerts when the spot price hits your chosen values 
1276355581700460544,2020-06-26 03:24:18,144643595,Where  gold going The black bar   TNT bar the price range  are above  but  have  wait  end  week  see   close above     going  blue crosses  not  keep ranging gold  stocks stock options option strategy trade 
1276353889248382978,2020-06-26 03:17:35,51340579,Click below  see  weekly Gold price prediction  the Pynk Beta Comment below  tell  your prediction CrowdWisdom XAUUSD XAU  Fintech artificialintelligence via 
1276347904547004423,2020-06-26 02:53:48,27652717,Gold Price Analysis XAU USD remains capped    HMA within  potential symmetrical triangle Gold Technical Analysis Commodities DollarIndex RiskAppetite
1276335753945952256,2020-06-26 02:05:31,2357679170,Click below  see  weekly Gold price prediction  the Pynk Beta Comment below  tell  your prediction CrowdWisdom XAUUSD XAU  Fintech artificialintelligence via 
1276334337093500930,2020-06-26 01:59:53,849051082747674624,Can  find physical Gold Prefer  bet  Gold price via trading platforms  are passing tricky days energetically speaking  commodities compare  USD Gold market can tell you  lot about what  going   other market 
1276332968764563457,2020-06-26 01:54:27,121189637, barrickgold Franco Nevada gold price  record high amp now the second row  getting interesting TIG TIGCF 
1276325045275553793,2020-06-26 01:22:58,739838958, The Victorian boom  Bendigo has surprised the world  Victoria  new gold rush amp Fosterville revival gold 
1276322926585880581,2020-06-26 01:14:33,2855981088, Gold Price Forecast Gold Markets Pullback Again goldnews goldupdate
1276317005230956545,2020-06-26 00:51:01,601945756, what exactly  going  happen  the price  silver  gold  crossing     and     
1276311809700421632,2020-06-26 00:30:22,472488467,Hong Kong Gold Price Morning Session Open     USD per              HKT
1276305181404065793,2020-06-26 00:04:02,125709367,Current Silver spot price     silver gold silverprice goldprice            
1276299499414175754,2020-06-25 23:41:27,1173879793730953216,Click below  see  weekly Gold price prediction  the Pynk Beta Comment below  tell  your prediction CrowdWisdom XAUUSD XAU  Fintech artificialintelligence via 
1276298799762354183,2020-06-25 23:38:41,1133941580866498560, GOLD miner candidates for PUT selling with market capitalization over   and price  earnings ratio under   ABX NGT  look specially attractive AEM stock StockMarket stockstowatch OptionsTrading options optionstrade 
1276296961558102016,2020-06-25 23:31:22,81635243,Click below  see  weekly Gold price prediction  the Pynk Beta Comment below  tell  your prediction CrowdWisdom XAUUSD XAU  Fintech artificialintelligence via 
1276296768213389317,2020-06-25 23:30:36,369786451,UAE shoppers are back  selling their gold  prices cross    gram Gold  current price high  just the push shoppers needed  cash out 
1276295681892773888,2020-06-25 23:26:17,1057768890845945856,Click below  see  weekly Gold price prediction  the Pynk Beta Comment below  tell  your prediction CrowdWisdom XAUUSD XAU  Fintech artificialintelligence via 
1276289324993130496,2020-06-25 23:01:02,601945756,SLV Silver Inflows Continue  Supply amp Price Drop silver gold COMEX LBMA TheBigSilverShort 
1276289160194605056,2020-06-25 23:00:22,472488467,Sydney Gold Price Open     USD per              EST
1276283526086832128,2020-06-25 22:37:59,1018985189001912321,     gold price  longer target   now     when Fed  assets collapse 
1276281019566567429,2020-06-25 22:28:01,27652717,Gold Price Analysis XAU USD pierces     amid fresh risk off move Gold RiskAversion Commodities Coronavirus TradeWar
1276276254602342402,2020-06-25 22:09:05,115709796,Gold  poised for  bullish break out trade upon  close above   However there  some technical evidence that  brief test  support might take place first Read more about gold  near term outlook  Gold TechnicalAnalysis 
1276262736238788608,2020-06-25 21:15:22,472488467,New York Globex Gold Price Close     USD per              EDT
1276261558977519619,2020-06-25 21:10:42,369786451, Gold Price  Euro  Euro USDollar today Jun     via 
1276258918314934272,2020-06-25 21:00:12,48728926,The spot gold price from has gone  through     toz        toz goldprice chart Sign  and get free email alerts when the spot price hits your chosen values 
1276250897279062018,2020-06-25 20:28:20,113619900,The price  gold may  unpredictable  the short term  has always held its value long term Contact Gold Rocks for more information gold investing karat 
1276240455362129921,2020-06-25 19:46:50,1233419564219654144,Click below  see  weekly Gold price prediction  the Pynk Beta Comment below  tell  your prediction CrowdWisdom XAUUSD XAU  Fintech artificialintelligence via 
1276235549494448133,2020-06-25 19:27:20,2726345108,How  RLG RLG  RLGMF still  this stock price with      Million Ounce RedLakeCamp gold resource     and counting 
1276227991589306368,2020-06-25 18:57:19,4048262236,Metal Silver News GOLD amp SILVER BEGIN THE MOVE  NEW ALL TIME HIGHS Gold  starting  upside break out price move targeting the 
1276226934997999619,2020-06-25 18:53:07,2449999863, GOLD BUY Price         Manage Risk forex stock market pips
1276226544009187330,2020-06-25 18:51:33,27652717,Gold Price Analysis There   very good support zone       Gold Commodities ChartPatterns ElliottWave DowTheory
1276222801725308930,2020-06-25 18:36:41,2726345108, XND XND  Here  Xander Resource  new company Deck These guys have  tight share structure low stock price and have great gold properties  the FenelonCamp amp Val  orCamp
1276221473997406209,2020-06-25 18:31:25,1232236535493337088, GOLD BUY Price         Manage Risk forex stock market pips
1276220718070542339,2020-06-25 18:28:24,1133941580866498560,Although gold prices have already made  significant comeback    the prices continuing  rise  April BAC raised its   month gold price target from         governments around the world unleashed large amounts  monetary stimulus  AEM ABX  KRR 
1276213572004085771,2020-06-25 18:00:01,1135674618222645248, Daily Price Update GOLD     USD SILVER     USD GOLD SILVER RATIO     
1276206134068572161,2020-06-25 17:30:27,472488467,New York Comex Gold Price Close     USD per              EDT
1276200434865262593,2020-06-25 17:07:48,1276187189030850562,Some people prefer  invest  gold  investing  gold miners  they know miners have higher ROI Does this logic also apply  the crypto space  crypto mining stock RIOT  the price above    sustained   would offer   Crypto bullish stocks cryptocurrency 
1276198624779808770,2020-06-25 17:00:37,1089353599501492225,Gold price              USD gold 
1276197613067472908,2020-06-25 16:56:36,898211495108112384,Good read well put together content Worth the read IMHO KRR lagging the intermediate producers with  lot  near term catalysts  boost the share price GOLD WESTERNGOLDFIELDS KRR  
1276197291758665731,2020-06-25 16:55:19,269307386,BMO trims full year price PGM price forecasts maintains gold silver outlooks investing metal mineral prices stocks commodities trading futures markets finance news money mining gold silver copper
1276194520280023041,2020-06-25 16:44:18,1057646004370059264, GOLD amp SILVER STOCKS  Sequential price analysis for   June   GDX GDXJ WPN FNV  
1276192687113285637,2020-06-25 16:37:01,23074277, Gold prices continue  have   within its sights  the precious metal hovers around    year high Get your XAUUSD market update from here 
1276190573842464775,2020-06-25 16:28:37,2772244957, Gold  playing with  feeling Ranging all day This  the level   watching   can close  stay above      think there   chance  hit  ish Price went   soon   entered short      Tragic 
1276186675081695233,2020-06-25 16:13:08,3367349775,     gold price  longer the target now     
1276185237895208960,2020-06-25 16:07:25,1119773744023707649, GDX expecting price action  climb above cloud support  the   min and   min which would keep price action above the cloud  the daily  OPINION Correlation with Gold remains strong while correlation with the SPX remains slightly negative GDXJ GLD 
1276180078037172225,2020-06-25 15:46:55,1057646004370059264, Tom Demark  Sequential price analysis for the   June   SPX NDX OIL GOLD TWTR AMZN CLX 
1276173158333190149,2020-06-25 15:19:25,887227145713577984,  well positioned  benefit from the rising gold price with its exploration projects  Senegal and Cameroon 
1276168362880462848,2020-06-25 15:00:22,472488467,London amp Zurich Gold Price Close     USD per              CEST
1276167981647740929,2020-06-25 14:58:51,901292690167541760, BMXI will blow    soon     gold price  longer target   now     when Fed  assets collapse GLD GDX NEM GOLD SLV SLW gold SPY INDU SPX
1276163513396928518,2020-06-25 14:41:06,4788342737,Gold  trading patterns foreshadow record highs  the   half    Bank  America says Gold Metals
1276157299220938760,2020-06-25 14:16:24,985268431619612673,Click below  see  weekly Gold price prediction  the Pynk Beta Comment below  tell  your prediction CrowdWisdom XAUUSD XAU  Fintech artificialintelligence via 
1276153674553856000,2020-06-25 14:02:00,48728926,The spot gold price from has gone down through     toz        toz goldprice chart Sign  and get free email alerts when the spot price hits your chosen values 
1276152467747725312,2020-06-25 13:57:12,58446532,The spot gold price from has gone down through     toz        toz goldprice chart Sign  and get free email alerts when the spot price hits your chosen values 
1276151518396383234,2020-06-25 13:53:26,960513587524456448, XAUUSD GOLD price hovers   with long wicks    not  good time  enter Wait for  clear direction gold trading trader  forex daytrading 
1276150158900760582,2020-06-25 13:48:02,138513820,BMO trims full year price PGM price forecasts maintains gold silver outlooks kitconews gold silver investing mining metals economics finance
1276145814767886344,2020-06-25 13:30:46,27652717,Gold Price Analysis XAU USD climbs above     after  data dump  XAUUSD Gold Metals
1276145430561271808,2020-06-25 13:29:14,66491057,There continues   looming uncertainty over second wave  the Coronavirus  the   compared gold price increases  rapid rise  Coronavirus cases globally During rampant rise  cases gold has increased   gold coronavirus BullionBuzz 
1276141372077031424,2020-06-25 13:13:07,278180555, initiates coverage  MAE this morning Speculative Buy      last price     Microcap with Major Potential  Old Mine  Renewed coi mining gold 
1276140835885715457,2020-06-25 13:10:59,19772589,Price  gold set  extend uptrend  India  domestic prices break INR     per   grams global scrap growing less than expected but mining forecast       with demand   
1276138432855760897,2020-06-25 13:01:26,58446532,The spot gold price from has gone  through     toz        toz goldprice chart Sign  and get free email alerts when the spot price hits your chosen values 
1276137675679039489,2020-06-25 12:58:26,218857792,Just like they have been controlling the price  precious metals for years Gold and Silver have been around for far longer than bitcoin will ever  and Government CANNOT eradicate  
1276137056494903296,2020-06-25 12:55:58,48728926,The spot gold price from has gone  through     toz        toz goldprice chart Sign  and get free email alerts when the spot price hits your chosen values 
1276136494969823232,2020-06-25 12:53:44,58446688,The spot gold price from has gone  through     toz        toz goldprice chart Sign  and get free email alerts when the spot price hits your chosen values 
1276133939070095369,2020-06-25 12:43:35,1490201472, Yesterday the gold price reached its highest peak since   The favourable outlook  thought   due  the pandemic amp central banks responses 
1276128085394354179,2020-06-25 12:20:19,472488467,New York Comex Gold Price Open     USD per              EDT
1276126791552233472,2020-06-25 12:15:11,183679872,     gold price  longer target   now     when Fed  assets collapse 
1276126760245972992,2020-06-25 12:15:03,138513820,Commerzbank Gold price declines still used  buying opportunities kitconews gold silver finance economics metals mining investing
1276126062120972288,2020-06-25 12:12:17,1208258174526087168,PAVOI   Gold Plated Sterling Silver Stud Earrings for Women Price price with discount    earrings gold pavoi plated silver sterling stud women 
1276123531106045952,2020-06-25 12:02:13,1275404229931302914,Major StockMarket global indeces are down amidst this chaos GOLD   Very possible the price  precious metals will keep  increasing amongst the economical uncertainty invest Economy ThursdayThoughts 
1276119678755143680,2020-06-25 11:46:55,409640111,While  continue  prepare for     take   However prepare accordingly because    the result  failed monetary policies and not  pretty social order hedgeaccordingly goldsilverratio silver gold stagflation 
1276118303153455106,2020-06-25 11:41:27,899661698335944704,With gold more than    off yesterday  highs the premium that GCQ  the active Comex future  trading above the spot OTC loco London gold price has narrowed  about      
1276117457997004801,2020-06-25 11:38:05,896319217192112129,AurusGOLD  the most liquid form  gold being ideal for gold accumulation  allows investors  buy fractions   gram   convenient price and without any frictions blockchain fintech gold liquidity investing goldtrading cryptocurrency 
1276112393240817665,2020-06-25 11:17:58,369786451, Gold Silver Ratio Crossed the   All Time High    but retraced all move above closed under        Jun     Gold  Silver Price and Gold Silver Ratio Jun     via 
1276112391525355520,2020-06-25 11:17:57,342156431, Gold  trading patterns foreshadow record highs  the   half    Bank  America says 
1276111278461693953,2020-06-25 11:13:32,820982287890157568,    GLD GOLD WED JUNE                    
1276108851104759808,2020-06-25 11:03:53,778862321728749568,After touching  record high       per    Ahmedabad yesterday gold price plunges       day  settle       
1276108675598483457,2020-06-25 11:03:11,1247519775141421058, hikes   month gold price forecast       GoldmanSachs gold  
1276107669921689602,2020-06-25 10:59:12,1008545808, Offering AAA Grade Quality natural Untreated Imperial Topaz beads  wholesale price Call      Website gemstone Jaipur jewelry jewelrylovers Jewel gemstones gems jewelrygram gold GEM silver 
1276101532551983104,2020-06-25 10:34:48,1868735647, Stock Market Enters Parabolic Price Move  Prepared Part  gold markets
1276100360596307974,2020-06-25 10:30:09,863397170417893376, MNRG Gold Goldridge Goldman Sachs Predicts      ounce Gold Within   Months The analysts predict low real interest rates and currency debasement concerns will create the perfect storm for  price hike 
1276097025382256641,2020-06-25 10:16:54,48728926,The spot gold price from has gone down through     toz        toz goldprice chart Sign  and get free email alerts when the spot price hits your chosen values 
1276095623415070720,2020-06-25 10:11:19,2773246477, Since January the price  gold has risen  almost   while almost all commodities are sinking    investment centralbank trading rebound preciousmetals 
1276091798914428929,2020-06-25 09:56:08,1181091558436683776,Wow GoldNecklace  Brampton Within Affordable Price Visit today located   The Gore  Unit   Brampton Ontario      Canada Location Web GoldNecklaceBrampton Gold GoldJewellery Jewellery 
1276091646078312448,2020-06-25 09:55:31,345403264,DAILY MARKET REPORT Thursday June     Global stocks and Oil down after IMF said the global economy will shrink     this year due  COVID  pandemic GOLD price steady above   Read more DowJonesFutures forex EURUSD dollar ecb 
1276086739438841856,2020-06-25 09:36:01,733382248230232064,    channel with low volume price rejection OneUpTrader GOLD TraderLife 
1276086329760190464,2020-06-25 09:34:24,58446688,The spot gold price from has gone down through     toz        toz goldprice chart Sign  and get free email alerts when the spot price hits your chosen values 
1276085636701646849,2020-06-25 09:31:38,85485138,WTI Crude Oil Price Analysis for June     Oil Silver Gold business stock market finance news
1276078941745250305,2020-06-25 09:05:02,125709367,Current Silver spot price     silver gold silverprice goldprice            
1276074520374325250,2020-06-25 08:47:28,1081549387522887680,Great read The price  tomorrow  With credit continuing  advance globally   only  shell game   where the next crisis originates Bitcoin Gold 
1276070155999752192,2020-06-25 08:30:08,1158082361646620674,Let  tell you something The gold price was       USD per             UTC goldprice gold price quote 
1276069136439881729,2020-06-25 08:26:05,1231175219374706688,Online Technical Analysis Gold Futures GOLD Futures futurestrading goldprice Golden 
1276066853832454146,2020-06-25 08:17:00,65570712,   gold price  longer target   now   when Fed  assets collapse GLD EDZ GLD gold  
1276055117611986944,2020-06-25 07:30:22,472488467,London Gold Price Open     USD per              BST
1276055087039696897,2020-06-25 07:30:15,1257994373683429377, COMEX CALL BUY GOLD          BUY LIMIT ORDER GOLD FORECAST GOLD PRICE ACTION TURNS  JOBLESS CLAIMS amp CORONAVIRUS CASES FOR BULLISH CATALYST for live trade contact  
1276054823918419968,2020-06-25 07:29:12,1257709255853047808, GOLDFORECAST GOLD PRICE ACTION TURNS  JOBLESS CLAIMS amp CORONAVIRUS CASES FOR BULLISH CATALYST COMEX BUY gold          BUY LIMIT ORDER Want more signals 
1276054717072695297,2020-06-25 07:28:47,1257701854974226433, GOLDFORECAST GOLD PRICE ACTION TURNS  JOBLESS CLAIMS amp CORONAVIRUS CASES FOR BULLISH CATALYST COMEX BUY gold          BUY LIMIT ORDER Want more signals 
1276050021889249280,2020-06-25 07:10:07,1216676903869931522,Click below  see  weekly Gold price prediction  the Pynk Beta Comment below  tell  your prediction CrowdWisdom XAUUSD XAU  Fintech artificialintelligence via 
1276049300326354944,2020-06-25 07:07:15,1273347744887984131,        Time  buy more Seriously hope people don  miss out Price  gold rocketing and Greatland Gold  the verge  biggest discovery  decades   excited for this  take off  July GGP AIM  GOLD 
1276048913573613568,2020-06-25 07:05:43,17473172,The Real Price  Stocks LIVE AMA with via bitcoin gold stonks
1276048521049681920,2020-06-25 07:04:09,2433277862,Gold Rate  India Today   June     amp   Carat Gold Price gold goldrate goldprice 
1276046073501323264,2020-06-25 06:54:26,775905636005445632,You can tell  haven  started the big bull run  Gold stocks when most ASX goldies sold off strongly today when AUD Gold price rose from yesterday  close 
1276042478462918656,2020-06-25 06:40:09,1149607999196938240,Click below  see  weekly Gold price prediction  the Pynk Beta Comment below  tell  your prediction CrowdWisdom XAUUSD XAU  Fintech artificialintelligence via 
1276040689827090433,2020-06-25 06:33:02,48728926,The spot gold price from has gone  through     toz        toz goldprice chart Sign  and get free email alerts when the spot price hits your chosen values 
1276040152134168576,2020-06-25 06:30:54,58446532,The spot gold price from has gone  through     toz        toz goldprice chart Sign  and get free email alerts when the spot price hits your chosen values 
1276039940246126593,2020-06-25 06:30:04,1276020535529361408,Gold price increasing day  day indicates that gold  the best instrument  hedge  uncertainties for centuries goldprice gold IndianEconomy Investment inflation
1276038149358022656,2020-06-25 06:22:57,19572471, Golden Bulls are  periods for idle idol worship Gold will always  gold  myth and  fact Golden Bulls Visualizing the Price  Gold from     
1276034842812018688,2020-06-25 06:09:48,18921618,The price  gold dropped sharply    per baht weight  morning trade  Thursday June   the Gold Traders Association reported gold price TheNationThailand 
1276033883444740102,2020-06-25 06:06:00,1259800828531130369,Gold Price Analysis Downside correction  not over just yet Gold XAUUSD sowingbean sowingbeanforex indianmarkets forex forexindia forexmarket forextrading forextrader StockMarket
1276033033821454337,2020-06-25 06:02:37,27652717,Gold Price Analysis Downside correction  not over just yet Confluence Detector  Gold XAUUSD
1276032467816689666,2020-06-25 06:00:22,472488467,Zurich Gold Price Open     USD per              CEST
