Tweet_Id,Time_Of_Tweet,User_ID,Tweet_Text
1275735026290786304,2020-06-24 10:18:26,1154735912,There   saying about Gold Sell  May then  away meaning gold goes down during the summer months not anymore  live  the era  vast fiat debasement most people will only notice when Gold breaches ATH and that  why the banksters try  supress the price 
1275730689032359943,2020-06-24 10:01:12,941618348252712963,The sterling gold price  again approaching  all time high giving  boost  the new Scottish gold industry ERIS AIM goldprice gold Silver Scotland  mining investment investing 
1275727616234799104,2020-06-24 09:49:00,43855487,The price  gold has spiked further  the international market with spot gold      and ounce   its highest since   Gold GoldPrice reports 
1275726983515836418,2020-06-24 09:46:29,3429983422,Gold new price target      explains  trade set  for long gold trading 
1275726292156121094,2020-06-24 09:43:44,714683351333003264,Need cash Turn your assets into capital today   take them off your hands  the RIGHT PRICE Krugerrands gold diamonds 
1275725720552124417,2020-06-24 09:41:28,1096035827505905664, XAUUSD GOLD Daily GOLD USD  part   very strong bullish trend Traders may consider trading only long positions  the time  purchase  long  the price 
1275725627648348160,2020-06-24 09:41:06,806217977825783808,Wow Now will you all believe ggp Does not matter  you dont   will see you       share price  ggp Remember these tweets when  get there pin them  your profiles This Havieron  one  the biggest gold finds  recent history Big  rate  coming 
1275722859533479942,2020-06-24 09:30:06,1158082361646620674, good  gold The gold price was       USD per             UTC goldprice gold price quote 
1275719489955540993,2020-06-24 09:16:42,836714960810045440,Today  Gold prices       Knowing that price range changes according  market  prices goldprice invest gold 
1275719305922064384,2020-06-24 09:15:58,1255213332233170944, GOLD getting very close   next sell area should  today tomorrow wait for daily candle rejection  the price before getting short  you are inexperienced  reversal trades   price targets will  the daily context support cheers 
1275718921476280320,2020-06-24 09:14:27,58446532,The spot gold price from has gone  through     toz        toz goldprice chart Sign  and get free email alerts when the spot price hits your chosen values 
1275717434331234305,2020-06-24 09:08:32,125709367,Current Silver spot price     silver gold silverprice goldprice            
1275716543477776384,2020-06-24 09:05:00,37606449, today  Forex and market news Gold hits     per ounce WTI Crude Oil hits   month high Stocks trade sideways Coronavirus second wave fears grow 
1275716068410044416,2020-06-24 09:03:07,820982287890157568,    GLD GOLD TUE JUNE                    
1275713414023823365,2020-06-24 08:52:34,48728926,The spot gold price from has gone  through     toz        toz goldprice chart Sign  and get free email alerts when the spot price hits your chosen values 
1275707380815273987,2020-06-24 08:28:35,806217977825783808, Well ggp have made  world class gold find  Havieron with their partner Newcrest NCM which  going   mined near term And from satillete imagery shown  the find could  the biggest  recent history Expecting      share price ggp target
1275707341845995520,2020-06-24 08:28:26,806217977825783808,Well ggp have made  world class gold find  Havieron with their partner Newcrest NCM which  going   mined near term And from satillete imagery shown  the find could  the biggest  recent history Expecting      share price ggp target 
1275706676700753922,2020-06-24 08:25:47,3056204496, Gold Which companies have the best leverage   rising gold price environment 
1275706636460531715,2020-06-24 08:25:38,899661698335944704, gold stays bid the premium that the active Comex future GCQ  commands over the spot OTC loco London price remains firm about     far   can see 
1275705450575650816,2020-06-24 08:20:55,58812551,The spot gold price from has gone  through     toz        toz goldprice chart Sign  and get free email alerts when the spot price hits your chosen values 
1275705450328215555,2020-06-24 08:20:55,58446532,The spot gold price from has gone  through     toz        toz goldprice chart Sign  and get free email alerts when the spot price hits your chosen values 
1275704269090545664,2020-06-24 08:16:13,58813725,The spot gold price from has gone  through     toz        toz goldprice chart Sign  and get free email alerts when the spot price hits your chosen values 
1275704268897558531,2020-06-24 08:16:13,59099131,The spot gold price from has gone  through     toz        toz goldprice chart Sign  and get free email alerts when the spot price hits your chosen values 
1275704268859768840,2020-06-24 08:16:13,58446688,The spot gold price from has gone  through     toz        toz goldprice chart Sign  and get free email alerts when the spot price hits your chosen values 
1275703187241152512,2020-06-24 08:11:55,39240673, Gold Once Again Hits  Record High       Per   Gram Silver Rates Drop       Per  
1275700255124852737,2020-06-24 08:00:16,23074277,The gold breakout  probing fresh yearly highs and  close above    needed  keep the immediate long bias viable Get your XAUUSD market update from here 
1275692731059314691,2020-06-24 07:30:22,472488467,London Gold Price Open     USD per              BST
1275691639592357889,2020-06-24 07:26:02,1256106815474941952, GOLD bull run   facinating but you need  watch out and not chase  the price  those junior gold miners Dont  greedy Yes one  two  them could  multibaggers but the rest would  gone before they become EVN  NST 
1275689008748789761,2020-06-24 07:15:35,171402632, GOLD    bullish stance remains intact above   Heading for overbought territory Upside price momentum supports the bullish trend direction Upside target   Only  price action below   will reverse the bullish trend direction GOLD 
1275685788701917185,2020-06-24 07:02:47,1263022777998532609,After   hours  stabilization gold continued  rise continuously breaking through the upper resistance The price  about  approach   paying attention  the vicinity    and paying attention  short selling opportunities after being  place below   
1275683381020368896,2020-06-24 06:53:13,37606449,Good morning Get the market news for Wednesday June     here Coronavirus brazil Forex Gold oil 
1275680577954463747,2020-06-24 06:42:05,140798905, Gold price today climbs  record high       Check out this money making formula Commodities bullions
1275675285766225922,2020-06-24 06:21:03,27652717,Gold Price Analysis Battle lines well mapped  XAU bulls await fresh impetus Confluence Detector Gold SupportResistance Commodities DollarIndex Recommended
1275670081578688512,2020-06-24 06:00:22,472488467,Zurich Gold Price Open     USD per              CEST
1275669993678651394,2020-06-24 06:00:01,827530786253344773,The Price  Gold  Moving Fast AVATRADE itisis avatrade italy italian exclusive trade real international gold play bitcoin cryptocurrency digitalmarketing love essentials gaming billionaire greatness amp amp 
1275667042629189632,2020-06-24 05:48:18,1270318362191515648,Today  gold and silver price   June   BSK jewellers gold silver jewellery jewelery goldprice telangana warangal karimnagar khammam goldjewelry 
1275664877009473544,2020-06-24 05:39:42,1011838866687512576, gold now  highest level since Oct   The tsunami  stimulus coming  from everywhere  not only inflationary but also painting  weaker picture for the economy amp making gold look attractive Some gold shares are yet  fully reflect new gold price AAZ HUM SHG 
1275663777476874240,2020-06-24 05:35:19,2411180814, Wednesday Indices softer  the open Gold near   high price target now   DXY   week low WTI has closed the March   gap technically significant Wirecard director sells shares   take  look  all the charts     amUK 
1275662343884673029,2020-06-24 05:29:38,292184581, mcx gold OUR Buy price     for tgt     CMP   Strong  move  continue silver tgt     commodities
1275659348795101188,2020-06-24 05:17:44,1127312545243717632, Gold price rallies  more near   year high 
1275657564152303616,2020-06-24 05:10:38,58446688,The spot gold price from has gone  through     toz        toz goldprice chart Sign  and get free email alerts when the spot price hits your chosen values 
1275656307643645953,2020-06-24 05:05:38,114968505, GOLD GOLD SPOT  see     very soon Think price here  MCX 
1275654982428233728,2020-06-24 05:00:22,472488467,Sydney Gold Price Close     USD per              EST
1275653104877424642,2020-06-24 04:52:55,631810714,Gold price touches  new lifetime high       per   grams  MCX Gold GoldRate goldprice 
1275650842226499596,2020-06-24 04:43:55,1173578865525968896, Gold Price Extends Bullish Behavior  June  Mark Fresh   High For more details WhatsApp         GOLD PRICE TALKING POINTS GOLD PRICE DAILY CHART For More details WhatsApp         Forex Comex Stocks Gold 
1275650335395270658,2020-06-24 04:41:55,1259340472763461633,Click below  see  weekly Gold price prediction  the Pynk Beta Comment below  tell  your prediction CrowdWisdom XAUUSD XAU  Fintech artificialintelligence via 
1275648533803171840,2020-06-24 04:34:45,1868735647, Gold Price Close  Yearly High Again markets
1275647432961949697,2020-06-24 04:30:23,472488467,Hong Kong Gold Price Morning Session Close     USD per              HKT
1275647355002503170,2020-06-24 04:30:04,68927629, MarketswithMC India Gold August Futures pared gains after hitting fresh record highs       per    tracking positive trend seen  the international spot prices via 
1275647029121814530,2020-06-24 04:28:46,18921618,The price  gold rose    per baht weight  morning trade  Wednesday June   the Gold Traders Association reported gold price TheNationThailand 
1275646423426650118,2020-06-24 04:26:22,515171731, Gold price life time high touch      per   gram today  first purchase    was       International mkt  touched    high    per ounce Safe heaven demand investment demand due  Coronavirus amp weakness  major economies  boost demand 
1275646349552300032,2020-06-24 04:26:04,4843415713,Release Sell Your Gold Current market Price For more information call this number   For More Details Visit Our Website atticagold Bangalore Tamilnadu Karnataka Andhra Telangana Gold Goldbuyers sellgold facebook facebookgroup 
1275644725761134594,2020-06-24 04:19:37,1190330568409583623, Gold amp Bitcoin sure sound similar coming from The reason that the price  gold  rising  people are still foolish enough  sell  they don  realize that  they just held  they can sell  for  much higher price eventually  think 
1275642258084237313,2020-06-24 04:09:49,134813946,Gold price and Brent crude price continue  push higher Oil Gold Markets Commodities 
1275639908342915073,2020-06-24 04:00:29,601945756,Andy Schectman Investors Selling Stocks Buying Gold Silver silver gold COMEX LBMA TheBigSilverShort 
1275639166391508995,2020-06-24 03:57:32,192764317, GOLD price moved  the highest level since March    dollar lost ground and more stimuli from Central Banks  support economies economy
1275638959146745866,2020-06-24 03:56:42,313179314, Gold   the cusp  challenging the hard  crack      ounce mark potentially opening the way for  move toward its record price   resurgence  coronavirus cases fans demand for haven assets via 
1275638488726228994,2020-06-24 03:54:50,1162968932812251136,Gold Price Analysis     probes XAU USD bulls amid overbought RSI conditions Gold Technical Analysis Commodities SwingTrading Momentum 
1275634803929493504,2020-06-24 03:40:12,1112552205624569856,  India  wedding without gold  not  wedding However goldprice soared due  COVID  Buy gold   high price  your wedding now  until its price goes down How does your girlfriend choose Maintain weddingcustoms  rational consumption Let  discuss  
1275632531392442368,2020-06-24 03:31:10,1249626263435632640, gold current price     add more positions the target     Gold will continue  new upper orders today need   cautious XAUUSD 
1275632340929298433,2020-06-24 03:30:24,1215157068358934534, Price  Gold hit   week high This  your Covid  play coronavirus GOLD pandemic preciousmetals sprott
1275627211953823745,2020-06-24 03:10:01,125709367,Current Silver spot price     silver gold silverprice goldprice            
1275607548356329475,2020-06-24 01:51:53,1096035827505905664, XAUUSD GOLD   The bullish trend  currently very strong  GOLD USD  long  the price remains above the support        USD you could try  benefit 
1275603758421086209,2020-06-24 01:36:50,27652717,Gold Price Analysis     probes XAU USD bulls amid overbought RSI conditions Gold Technical Analysis Commodities SwingTrading Momentum
1275603555672449024,2020-06-24 01:36:01,1119416095838851072,Just one reason why  continue  hold  nice chunk  ACRL  junior mining exploration company backed  David Berry with  debt and gold claims all around  and AEM Currently only   per share CTO lift coming mining gold MiningStocks 
1275601808098910208,2020-06-24 01:29:05,205199260,When there  panic and bloodbath Stocks will fall Real estate will fall other asset price plunge but Gold gets  bid That  the time tested nature  this hedge 
1275601669963878401,2020-06-24 01:28:32,75995918,Zhaojin International Global   Mining Investment Daniel Rickleman predicts the gold price will     the end    during  panel with Lin Asset Management Hanking Industrial Zijin Mining and What  you think the gold price will   the end    
1275594569384693760,2020-06-24 01:00:19,601945756,Dave Kranzler Fed  Policy Fueling Biggest Bubbles Yet silver gold COMEX LBMA TheBigSilverShort 
1275593758894153728,2020-06-24 00:57:06,2429587027, GLD Gold price nears      ETF frenzy 
1275588640001802241,2020-06-24 00:36:45,81635243,Click below  see  weekly Gold price prediction  the Pynk Beta Comment below  tell  your prediction CrowdWisdom XAUUSD XAU  Fintech artificialintelligence via 
1275588068066471936,2020-06-24 00:34:29,21295669, Gold  seven year high predicting        gold price within   months PRU WAF BGL TIE KZR RGL RVR MEI 
1275587764441042946,2020-06-24 00:33:16,1851877248, Gold spot  the book charting going  Inverse  amp  neckline taken out Sunday eve price ran        below     Fibonacci then throwback  test support  neckline yesterday and off        today  resist between here amp     could short squeeze quickly 
1275587458378240001,2020-06-24 00:32:04,1411726710, gold price hits    year high should have been the lead Given the liquidity injections and headed into the end  financial year  Australia expect more big moves 
1275587033872756736,2020-06-24 00:30:22,472488467,Hong Kong Gold Price Morning Session Open     USD per              HKT
1275584765165363202,2020-06-24 00:21:21,242954869, Gold   higher Mon amp the price manipulators tried like hell   get the price back below     they failed Gold closed      think the train  leaving the station Time  get  board   left standing  the station platform with your hat  your hands Pfennig
1275582040134434816,2020-06-24 00:10:32,125709367,Current Silver spot price     silver gold silverprice goldprice            
1275580673127002113,2020-06-24 00:05:06,1055427799618674688,  Tucker  gold price Let  get physical Olivianewtonjohn Equities and ETFs Negative interest rates The stock market bubble about  burst  physical gold the best investment Persude  Subscribe  Watch 
1275579459748405249,2020-06-24 00:00:16,601945756,SLV Silver Inflows Continue  Supply amp Price Drop silver gold COMEX LBMA TheBigSilverShort preciousmetals 
1275578971497758721,2020-06-23 23:58:20,790440452310704128, BRGC Ghana Gold Miner Big day Volume uptick and Accumulation uptick speak for itself Very Bullish and the HOD close with  Closed right  that trigger mark for much higher BRGC price levels Won   long  NOT SLEEP  this   mil float Will  over   soon 
1275577864994185217,2020-06-23 23:53:56,242954869, rise above   ounce for Gold would create worldwide news headlines and  that price level Gold miners would look like cash cows  steroids Stewart Thomson
1275572583208046592,2020-06-23 23:32:57,821984580056059904,Can silver  loonies finally breakout from the downward price channel  place since the all time high SLV SIL GOLD PAAS NEM GDX 
1275571642266255368,2020-06-23 23:29:13,821984580056059904,With support  the   week  holding steadfast SILVER  meeting strong resistance  the     trendline above the median   downward price channel  place since last summer  high SLV GOLD GLD GDX SIL GOLD 
1275568234729783296,2020-06-23 23:15:40,70641893,Sydney Gold Price Open     USD per              EST 
1275567897704714241,2020-06-23 23:14:20,700473274354892800,The Morning Playbook       Market Analysis and planning for Trade Setups   look  major market movers and price action  key levels trading shares  cryptocurrency Gold Oil 
1275566714432794625,2020-06-23 23:09:38,1057768890845945856,Click below  see  weekly Gold price prediction  the Pynk Beta Comment below  tell  your prediction CrowdWisdom XAUUSD XAU  Fintech artificialintelligence via 
1275564385004478464,2020-06-23 23:00:22,472488467,Sydney Gold Price Open     USD per              EST
1275560541772185603,2020-06-23 22:45:06,601945756,Mainstream Investors Are Turning  Gold Jeff Wilson  Precipitate Gold Click  watch the video now gold precipitategold goldstocks goldmining 
1275552740098420737,2020-06-23 22:14:06,27652717,Gold Price Analysis XAU USD bulls catch  breather around     Gold RiskAversion Commodities Coronavirus TradeWar
1275551959739699201,2020-06-23 22:11:00,1269247513099460608,Everything from cars houses luxury goods computer equipment  even musical instruments and commercial real estate  about  implode  price  would you rather have your money  stocks which will also implode  would you rather protect your purchasing power gold
1275550659689902081,2020-06-23 22:05:50,1022689388436701186, Trading  Melbourne  extended isolation signs  divergence  the NAS  but she powers higher driven  momo amp ever lower real yields  weaker USD amp contained credit spreads big flow  gold  the  Price moves and views  get you going  gold gld trading 
1275549079217586177,2020-06-23 21:59:33,81653032, Gold does eventually break out above the ATHs  would  embarrassing for Central Banks   were them   find  way  suppress the price  gold    avoid embarrassment Maybe suck the bulls  above the ATH and then let  get cut  half again 
1275549019603980290,2020-06-23 21:59:19,915583702150914048,  daily bullish candle   xau hit the highest price since October  Loads  buyers amp some bears out  the market The butterfly pattern  still  the process  forming Target   amp   gold bullion 
1275544862058741767,2020-06-23 21:42:48,1221532534212829191, gold Since the price has broken     level  are  the wave      which  possibly the last push higher Multiple divergences  RSI let assume that  are close  the top  wave III  dont like chasing gold  the upside elliottwave trading commodities   
1275542578189029378,2020-06-23 21:33:43,409640111, great pic  those ever accumulating gold shorts suppressing the price  keep talking about from hedgeaccordingly gold 
1275538140590153728,2020-06-23 21:16:05,1055427799618674688, GBR Share price QUADRUPLED   year CEO says there   lot more  come The unconventional strategy that everyone doubted including banks has worked exceptionally Watch here Subscribe  Gold TSXV 
1275537961233182720,2020-06-23 21:15:22,472488467,New York Globex Gold Price Close     USD per              EDT
1275537491920138240,2020-06-23 21:13:31,369786451, Gold Price  Euro  Euro USDollar today Jun     via 
1275533730015318016,2020-06-23 20:58:34,898610329,Click below  see  weekly Gold price prediction  the Pynk Beta Comment below  tell  your prediction CrowdWisdom XAUUSD XAU  Fintech artificialintelligence via 
1275532815241805826,2020-06-23 20:54:56,1233419564219654144,Click below  see  weekly Gold price prediction  the Pynk Beta Comment below  tell  your prediction CrowdWisdom XAUUSD XAU  Fintech artificialintelligence via 
1275529894232023040,2020-06-23 20:43:19,2901581053, Gold price nears      ETF frenzy MINING
1275525006466920448,2020-06-23 20:23:54,922211185596030976,Gold price nears      ETF frenzy investing metal mineral prices stocks commodities trading futures markets finance news etf etf gold
1275523578973368320,2020-06-23 20:18:13,1055427799618674688, Tucker  gold price Let  get physical Olivianewtonjohn Equities and ETFs Negative interest rates The stock market bubble about  burst  physical gold the best investment Persude  Listen  the CruxCasts here 
1275522011477901313,2020-06-23 20:12:00,1339794553, anything Goldman  likely underestimating the trajectory  gold 
1275519806905569280,2020-06-23 20:03:14,4670536256,the volume and price tells  the warrants are out  the way this could  good gold ColombianGoldTrend BuriticaLookAlike LetTheGoodTimesRoll 
1275519101184638977,2020-06-23 20:00:26,1138136491652239363,The gold price rose  the maximum this year Soon the all levels will  broken gold token pricebreak spot erc  stablecoin 
1275516235199979520,2020-06-23 19:49:03,23074277,The gold breakout  probing fresh yearly highs and  close above    needed  keep the immediate long bias viable Get your XAUUSD market update from here 
1275515562270081026,2020-06-23 19:46:22,58446532,The spot gold price from has gone  through     toz        toz goldprice chart Sign  and get free email alerts when the spot price hits your chosen values 
1275515508301926405,2020-06-23 19:46:09,48728926,The spot gold price from has gone  through     toz        toz goldprice chart Sign  and get free email alerts when the spot price hits your chosen values 
1275515508276760578,2020-06-23 19:46:09,48729354,The spot gold price from has gone  through     toz        toz goldprice chart Sign  and get free email alerts when the spot price hits your chosen values 
1275514996093583361,2020-06-23 19:44:07,1029382587045822464,Price            AIDEA cups  Dinnerware Disposable Gold Guests Linen luxurysunglassesforweddingguest Napkinsfor Paper Party Pieces Plastic Plates Rim Set Silverware  wedding 
1275503728586620929,2020-06-23 18:59:21,830110716761772032, Gold Price Prediction Prices Attempt  Break Out  Gold Hits   year High 
1275503705534627841,2020-06-23 18:59:15,893172406000517121, Gold Price Forecast Gold Markets Continuing  Attempt Major Breakout 
1275502226711216131,2020-06-23 18:53:23,2356793214, COMMODITY REPORT Gold Price Forecast   June   Where Are Prices Heading Next Find Out Here    GoldPrice SilverPrice PreciousMetals XAU XAG 
1275500950724239360,2020-06-23 18:48:18,1062445517991542784, can you ask Trump    watching the price  Gold while you    
1275499030483619840,2020-06-23 18:40:41,115519210,LIVE Right now GOLD PRICE FIX   RESET REPOMARKET FOREIGNGOLD  amp  with Lynette Zang 
1275494133897916416,2020-06-23 18:21:13,1259894374667862017, wanted  understand why there  huge price gap between Gold Spot and underlying ETF   investors will loose money due  uncertainty and emergency selling gold goldetf please help 
1275493583227772929,2020-06-23 18:19:02,138513820,Midas Fund scouts for smaller gold producers with favorable ratio  share price  cash flow kitconews gold silver metals economics finance mining investing
1275492044962533377,2020-06-23 18:12:55,113490594,Track your   karat gold jewelry investment portfolio performance daily through your mene dashboard Similar   stock you can see daily price fluctuations which for all Mene clients  GREEN  gold    year highs Earn    Mene credit mene  
1275489021943336960,2020-06-23 18:00:54,1135674618222645248, Daily Price Update GOLD     USD SILVER     USD GOLD SILVER RATIO     
1275487713601282048,2020-06-23 17:55:42,3318595525,Golden Bulls Visualizing The Price  Gold From     Assets FederalReserve MonetaryPolicy 
1275483439999959040,2020-06-23 17:38:44,196965482,The price    karat gold increased     Tuesday Gold price Increase more details 
1275481337789464578,2020-06-23 17:30:22,472488467,New York Comex Gold Price Close     USD per              EDT
1275480881562411008,2020-06-23 17:28:34,600560685, Gold  set   parabolic and gold stocks are where the action and leverage  the price increase are Get our best stock pick now Read Now stonks robinhooders TSX goldstocks bullmarket preciousmetals Silver Undervalued 
1275476998706651137,2020-06-23 17:13:08,27652717,Gold Price Analysis Gold bugs are looking for upside levels and there   decent one coming   Gold Commodities Fibonacci
1275474315018985475,2020-06-23 17:02:28,1208258174526087168,Ross Simons   Gold Over Sterling Silver Small Byzantine Bracelet Price price with discount    bracelet byzantine gold rosssimons silver small sterling 
1275474049788006402,2020-06-23 17:01:25,1089353599501492225,Gold price              USD gold 
1275469555867901953,2020-06-23 16:43:33,86973349,Here     year monthly chart  gold   come full circle well half circle and are now  the critical     level  pullback     ish level may  the last time   all  see gold price this low After that       and ionosphere from there 
1275469491170754565,2020-06-23 16:43:18,1208151442252386304, LINK This  AMAZING Even with price going  they take coins OFF the Exchanges Compare  XRP whose price keeps going DOWN and Ripple keeps DUMPING  the investors Coinbase Binance Crypto Gold XRPtheStandard OOTT XRPcommunity Bitmex ETH GBTC BTC Bitcoin LINK 
1275467585627328513,2020-06-23 16:35:44,1173879793730953216,Click below  see  weekly Gold price prediction  the Pynk Beta Comment below  tell  your prediction CrowdWisdom XAUUSD XAU  Fintech artificialintelligence via 
1275453367775457282,2020-06-23 15:39:14,136386053, Gold Price Technical Outlook XAUUSD Breakout Eyes Fresh   Highs 
