Tweet_Id,Time_Of_Tweet,User_ID,Tweet_Text
1277490873350057985,2020-06-29 06:35:33,703890728187875328,Click below  see  weekly Gold price prediction  the Pynk Beta Comment below  tell  your prediction CrowdWisdom XAUUSD XAU  Fintech artificialintelligence via 
1277484642921263106,2020-06-29 06:10:48,70641893,Zurich Gold Price Open     USD per              CEST 
1277483338438193154,2020-06-29 06:05:37,27652717,Gold Price Analysis Strong support opens door  fresh gains Confluence Detector  Gold XAUUSD
1277482126959673344,2020-06-29 06:00:48,1049092230596579328,     Gold    Could  breach the price level investment 
1277482018901614592,2020-06-29 06:00:22,472488467,Zurich Gold Price Open     USD per              CEST
1277480428316717058,2020-06-29 05:54:03,110793585, Gold Price Analysis XAU USD builds  Friday  rebound  test   
1277480353305853956,2020-06-29 05:53:45,2356793214,WEEK AHEAD COMMODITY REPORT Gold Silver amp Crude Oil Price Forecast   June   July   Where Are Prices Heading Next Find Out Here    GoldPrice SilverPrice PreciousMetals GLD OilPrice CrudeOil OOTT 
1277479818959843330,2020-06-29 05:51:37,1270318362191515648,Today  gold and silver price   June   Bsk jewellers visit your nearest show room gold silver goldprice goldpricetoday hyderabad khammam warangal karimnagar goldjewelry jewelry jewellery hyderabad southindia telugu 
1277478845969338368,2020-06-29 05:47:45,861576128665800705, Gold Price Analysis XAU USD builds  Friday  rebound  test   Gold XAUUSD  looking  build onto Friday  sharp   reversal  Monday  the bulls have regained control  early European trading following  brief phase  upside consolidation FXStreet 
1277478363771408384,2020-06-29 05:45:50,1127312545243717632, Gold price rises  virus concerns lift safe haven bid 
1277476005200957441,2020-06-29 05:36:28,963518558297870338,Gold Price Analysis XAU USD builds  Friday  rebound  test   GOLD priceaction XAUUSD metal Commodities BREAKING 
1277474751733215237,2020-06-29 05:31:29,48728926,The spot gold price from has gone  through     toz        toz goldprice chart Sign  and get free email alerts when the spot price hits your chosen values 
1277471644127125505,2020-06-29 05:19:08,68927629, MarketswithMC India Gold August Futures rose following  positive trend  the international spot prices Here are trading strategies  experts  
1277469430658859008,2020-06-29 05:10:21,70641893,Sydney Gold Price Close     USD per              EST 
1277467410308702208,2020-06-29 05:02:19,27652717,Gold Price Analysis XAU USD builds  Friday  rebound  test   Gold Commodities DollarIndex Coronavirus RiskAppetite
1277466919960887296,2020-06-29 05:00:22,472488467,Sydney Gold Price Close     USD per              EST
1277465753885667328,2020-06-29 04:55:44,1352760990,Once Gold price levels break above   then the rally     almost certain  drive investors into the preciousmetals markets   much faster pace   not seen anything like this early   through   when precious metals rallied   
1277465058776252416,2020-06-29 04:52:58,242954869,The FED has expanded its balance sheet from       dollars  whopping   have been printed  just   mos The stock price  earnings ratio has reached record levels This   highly unsustainable situation when the bubbles burst more investors will turn  Gold 
1277464335774707712,2020-06-29 04:50:06,2433277862,Gold Rate  India Today   June     amp   Carat Gold Price gold goldrate goldprice todaygoldrate todaygoldprice 
1277461919432151040,2020-06-29 04:40:30,70641893,Hong Kong Gold Price Morning Session Close     USD per              HKT 
1277459695876227072,2020-06-29 04:31:40,2433277862,Gold Rate Today  Jaipur   June     amp   Carat Gold Price gold goldrate goldprice todaygoldprice todaygoldrate 
1277459372604448769,2020-06-29 04:30:23,472488467,Hong Kong Gold Price Morning Session Close     USD per              HKT
1277454895772205057,2020-06-29 04:12:35,723456265784037377,Thanks for the kind words Quality  amazing for the price and seller replies promptly this     purchase  this seller and  loved all  the products Will  buying more Sazehra  etsy gold pearl women  glass indianj 
1277453249864282113,2020-06-29 04:06:03,1093555573503811584,FTSE investors Can the gold price reach  new record high  July Motley Fool  gold goldnews goldbullion
1277452062654111744,2020-06-29 04:01:20,1094811551305936896,Despite soaring Bitcoin price predictions and increased reporting  adoption and even rumors that will begin offering Bitcoin sales  its   million users investor says  all time high will  achieved  Gold not Bitcoin 
1277451727373889536,2020-06-29 04:00:00,81091668,Want  take advantage  the gold price Rally Follow this strategy preciousmetals goldprice financialplanning investors 
1277449520293515264,2020-06-29 03:51:14,1233419564219654144,Click below  see  weekly Gold price prediction  the Pynk Beta Comment below  tell  your prediction CrowdWisdom XAUUSD XAU  Fintech artificialintelligence via 
1277443870804987904,2020-06-29 03:28:47,231164809, Gold XAUUSD  time  price Note      for the downside price 
1277440732123459585,2020-06-29 03:16:18,292184581, commodities markets update gold silver price   economic recovery concerns comex gold         silver           Crude prices lower  fresh coronavirus cases WTI      bbl     BRENT    bbl Copper prices  
1277437517495586817,2020-06-29 03:03:32,125709367,Current Silver spot price     silver gold silverprice goldprice            
1277434465292345344,2020-06-29 02:51:24,596314764, Gold  the daily chart gold price has been trading within  wedge formation Price recently took support  the lower end  the range amp retraced back within the range Gold Traders Trading DealmoneySecurities CommodityDaily 
1277429745685168128,2020-06-29 02:32:39,804923114,Click below  see  weekly Gold price prediction  the Pynk Beta Comment below  tell  your prediction CrowdWisdom XAUUSD XAU  Fintech artificialintelligence lewat 
1277427424670765056,2020-06-29 02:23:26,58446688,The spot gold price from has gone down through     toz        toz goldprice chart Sign  and get free email alerts when the spot price hits your chosen values 
1277423050598776832,2020-06-29 02:06:03,1055427799618674688,  Tucker  gold price Let  get physical Olivianewtonjohn Equities and ETFs Negative interest rates The stock market bubble about  burst  physical gold the best investment Persude  Subscribe  Watch 
1277419114886283264,2020-06-29 01:50:24,58446532,The spot gold price from has gone down through     toz        toz goldprice chart Sign  and get free email alerts when the spot price hits your chosen values 
1277418668922671107,2020-06-29 01:48:38,48728926,The spot gold price from has gone down through     toz        toz goldprice chart Sign  and get free email alerts when the spot price hits your chosen values 
1277418518296707075,2020-06-29 01:48:02,1093555573503811584,Gold Price Analysis XAU USD bears lining  for potential phase  distribution FXStreet gold goldnews goldbullion
1277416930731753475,2020-06-29 01:41:44,719400088741621760,Last week  panelists predict       gold price  Christmas insight 
1277416405017780225,2020-06-29 01:39:38,1868735647, Gold Price Forecast Consolidation Followed   Summer Breakdown 
1277409072460029953,2020-06-29 01:10:30,27652717,Gold Price Analysis XAU USD bears lining  for potential phase  distribution  Gold XAUUSD Technical Analysis Coronavirus DollarIndex
1277403180133998592,2020-06-29 00:47:05,70641893,Hong Kong Gold Price Morning Session Open     USD per              HKT 
1277398973272125440,2020-06-29 00:30:22,472488467,Hong Kong Gold Price Morning Session Open     USD per              HKT
1277398898550734849,2020-06-29 00:30:04,936941108487057408,New Bitcoin price model suggests exponential bull run  one month BTC crypto cryptocurrency ETH Ethereum money trading investment Blockchain DeFi gold price tech XRP XMR LTC BCH BNB BSV fintech finance 
1277398772297826304,2020-06-29 00:29:34,1057768890845945856,Click below  see  weekly Gold price prediction  the Pynk Beta Comment below  tell  your prediction CrowdWisdom XAUUSD XAU  Fintech artificialintelligence via 
1277392471685607426,2020-06-29 00:04:32,125709367,Current Silver spot price     silver gold silverprice goldprice            
1277380924171325440,2020-06-28 23:18:39,70641893,Sydney Gold Price Open     USD per              EST 
1277378673692119040,2020-06-28 23:09:43,81635243,Click below  see  weekly Gold price prediction  the Pynk Beta Comment below  tell  your prediction CrowdWisdom XAUUSD XAU  Fintech artificialintelligence via 
1277377440659062785,2020-06-28 23:04:49,1220778125069443072, Record Gold Price Forecasts Boost Prospects for Junior Mining Companies gold silver preciousmetals YahooFinance StockMarketCrash  dollardevaluation Trump 
1277376323837550593,2020-06-28 23:00:22,472488467,Sydney Gold Price Open     USD per              EST
1277373712594087936,2020-06-28 22:50:00,483178801,Second Wave  Push Gold Price    According  Goldman Sachs and Peter Schiff Gold BTC Bitcoin blockchain cryptocurrency BTC ETH ETH ethereum USDT Crypto Altcoins 
1277369819323486208,2020-06-28 22:34:31,285244709, Silver monthly chart Orange shows price action     each year Seasonality  important when investing  had  few price actions but that was   bear market and   expected Will  see     never know but odds are good trading investing Gold 
1277365701431492608,2020-06-28 22:18:10,27652717,Gold Price Analysis XAU USD refreshes multi year high above      virus woes deepen Gold Coronavirus TradeWar Commodities Politics
1277364472655556611,2020-06-28 22:13:17,48728926,The spot gold price from has gone  through     toz        toz goldprice chart Sign  and get free email alerts when the spot price hits your chosen values 
1277363158815059977,2020-06-28 22:08:03,1055427799618674688, GBR Share price QUADRUPLED   year CEO says there   lot more  come The unconventional strategy that everyone doubted including banks has worked exceptionally Watch here Subscribe  Gold TSXV 
1277361191384485889,2020-06-28 22:00:14,59098914,The spot gold price from has gone  through     toz        toz goldprice chart Sign  and get free email alerts when the spot price hits your chosen values 
1277361191367696385,2020-06-28 22:00:14,58446532,The spot gold price from has gone  through     toz        toz goldprice chart Sign  and get free email alerts when the spot price hits your chosen values 
1277361191199924225,2020-06-28 22:00:14,58812551,The spot gold price from has gone  through     toz        toz goldprice chart Sign  and get free email alerts when the spot price hits your chosen values 
1277361169125314567,2020-06-28 22:00:09,1158082361646620674,Fact time The gold price was       USD per             UTC goldprice gold price quote 
1277351857862537216,2020-06-28 21:23:09,81742255, Gold Completes Another Washout Rotation Here        seems  though every time Gold completes one  the moderate low price rotations   call   washout low rotation  sets  for  new momentum rally   new momentum price base 
1277349812992606214,2020-06-28 21:15:02,23074277, Gold prices may rise  global virus uncertainty boosts demand for safety  Dollar weakness amid accommodative central bank policy could provide added support Get your metals update from here 
1277349148224901120,2020-06-28 21:12:23,995397712836251650, Gold predicted     the next Covid wave according  Goldman Sachs  smart time  buy from from your home       backed gold from London Bullion Market Association Can Buy Use Sell  XPOS XPASS  XWallet Buy amp HODL 
1277344783380422657,2020-06-28 20:55:02,936941108487057408, Crypto derivatives might drive  new cycle  mass adoption Bitcoin BTC Crypto cryptocurrency trading invest money price ETH Ethereum XRP XMR BCH BNB BSV CryptoNews Blockchain gold ADA XTZ XVG market 
1277338327880994817,2020-06-28 20:29:23,1196594994305482752,Gold Price Analysis Week  June     Practical Forex Trading via GOLD XAU goldprice
1277335503428354048,2020-06-28 20:18:10,2906083852,  never purchased  controlled Gold Silver etc but   believe they will  significantly increasing  price value over the upcoming years Significantly StockMarket Gold
1277333252458663936,2020-06-28 20:09:13,982289611140534272, ICO  LIVE Soft Cap       Hard Cap       Total GLDS tokens       Price   blockchain cryptocurrency gold investment token business crypto cryptocurrency 
1277331102861012998,2020-06-28 20:00:41,25501714,   gone vertical  late Long Term Gold Silver Price Forecasts needed update accordingly Conservative      gold amp    silver based  BRRR 
1277324972214583296,2020-06-28 19:36:19,12012772,The price  gold may  unpredictable  the short term  has always held its value long term Contact Gold Rocks for more information gold investing karat 
1277320873037434887,2020-06-28 19:20:02,51340579,Click below  see  weekly Gold price prediction  the Pynk Beta Comment below  tell  your prediction CrowdWisdom XAUUSD XAU  Fintech artificialintelligence via 
1277318523870605312,2020-06-28 19:10:42,15879693,Gold Completes Another Washout Rotation Let  explain our thinking   explore this price pattern  bit further  GLD IAU GDX GDXJ silver preciousmetals stocks gold covid  investing
1277313782403026944,2020-06-28 18:51:51,2235329532,Second Wave  Push Gold Price    According  Goldman Sachs and Peter Schiff 
1277304605441814528,2020-06-28 18:15:23,1272591765913010176,Phil Carr uses strategies for trading the precious metals that  use here  Gold Silver WEEK AHEAD COMMODITY REPORT Gold Silver amp Crude Oil Price Forecast   
1277302588489248769,2020-06-28 18:07:22,42910193, Gold price rising 
1277300817310232578,2020-06-28 18:00:20,1135674618222645248, Daily Price Update GOLD     USD SILVER     USD GOLD SILVER RATIO     
1277297175047950342,2020-06-28 17:45:52,1239241647612997632, CKG  popped    Friday after Eric Sprott mentioned  his weekly wrap  that  you believe the price  gold  going  you should start thinking about low grade large tonnage operations like Chesapeake Gold sprottwatch silver stocks stockstowatch StocksToTrade
1277295353948246017,2020-06-28 17:38:38,534977426,Which assets price movement  more correlated with the total stock market gold bitcoin crypto investing stocks
1277290597326262278,2020-06-28 17:19:43,3038208674,Gold Completes Another Washout Rotation Let  explain our thinking   explore this price pattern  bit further  GLD IAU GDX GDXJ silver preciousmetals stocks gold covid  investing
1277285966030520322,2020-06-28 17:01:19,1089353599501492225,Gold price              USD gold 
1277283767846088705,2020-06-28 16:52:35,795144650264899588, Since gold peaked almost   years ago its price has fallen  over   while the price  Bitcoin has risen  over      which one   has been wrong over the past   years Both are headed higher but you remain  denial You  the cry baby 
1277280942965612544,2020-06-28 16:41:22,56562803, Since Bitcoin peaked over     years ago its price has fallen  over   while the price  gold has risen  over    which one   has been wrong over the past     years Bitcoin    bear market and headed much lower yet you remain  denial You  the cry baby 
1277280021170683904,2020-06-28 16:37:42,1055287604113924097, GDX Gold Miner ETF KEY LEVELS Locked  solid uptrend  price riding   retest      resistnc likely this week     reasonable   price target RESISTANCE                 SUPPORT                       FNV SAND EQX MUX 
1277269227045453827,2020-06-28 15:54:48,79317069,Gold Completes Another Washout Rotation Let  explain our thinking   explore this price pattern  bit further  GLD IAU GDX GDXJ silver preciousmetals stocks gold covid  investing
1277261182022361089,2020-06-28 15:22:50,999718950257680384,Bitcoin Price Forms Striking Correlation  Gold What This Means for BTC crypto bitcoin BTC gold XAU assets
1277257086817103872,2020-06-28 15:06:34,2802934477,Gold Completes Another Washout Rotation Let  explain our thinking   explore this price pattern  bit further  GLD IAU GDX GDXJ silver preciousmetals stocks gold covid  investing
1277257076939472896,2020-06-28 15:06:32,1093555573503811584,Gold Price Prediction Prices Consolidate and Form Doji Day Yahoo Finance gold goldnews goldbullion
1277256485517615104,2020-06-28 15:04:11,1079749795823214594, XAUUSD Gold  buy above the cloud   previous point  interest black drawn line  could see  pull back here   could see price accelerate through Your guess   good  ours trading investing fintwit commodities metals 
1277253557796786177,2020-06-28 14:52:33,1093555573503811584,Record gold price forecasts boost prospects for junior mining companies CTV News gold goldnews goldbullion
1277248513932496897,2020-06-28 14:32:30,160178131, You are right  clue what target price will   end  year will  huge anyway deg gold
1277247721586544643,2020-06-28 14:29:21,2726345108,The stock price  rolling RedLakeCamp gold exploration mining 
1277246687807860738,2020-06-28 14:25:15,45253155,Gold Completes Another Washout Rotation Let  explain our thinking   explore this price pattern  bit further  GLD IAU GDX GDXJ silver preciousmetals stocks gold covid  investing
1277246005356855296,2020-06-28 14:22:32,1093555573503811584,Record gold price forecasts boost prospects for junior mining companies Yahoo Canada Finance gold goldnews goldbullion
1277238256103546882,2020-06-28 13:51:44,1563596376, Gold    Wave    Finished    Wave    with   Started    Wave      finished    and wave      must Correct the first wave           the price back down under   that means wave    failed and  have Extended wave    
1277229021974212609,2020-06-28 13:15:03,936941108487057408, Bitcoin cash sets all time low against BTC and analysts are still bearish Crypto cryptocurrency ETH Ethereum trading DeFi Blockchain FinTech money XMR LTC XRP BCH BNB BSV price mining cardano Gold bullish 
1277226036728598530,2020-06-28 13:03:11,802994138069073922, Trend Alert   Yellow Gold    Diamond Cut Hoop Earrings     Diameter Price     Dazyle style fashion gold jewelry influencers 
1277224044463611904,2020-06-28 12:55:16,404815131,  you look  the inflation adjusted price  that time  barley moved You can  say the same about stocks GOLD 
1277221494569959424,2020-06-28 12:45:08,1217369197895770112,After momentary correction gold price  ready  attack     and higher analysts Gold gold preciousmetals Markets investing 
1277217711144275968,2020-06-28 12:30:06,2576691870,Our  Gold Room Odourisers are accessible  purchase direct from    competitive price  the internet purchase single  Gold fragrances  multi packs the more  Gold you purchase the less expensive  gets CLICK THE LINK  SEE MORE 
1277210532404224000,2020-06-28 12:01:35,246812115,One week after  robust price rebound oil  back  the Covid crossroads  the familiar question pops  Will recovery continue  are  headed for another lockdown  sorts Gold meanwhile heads for   OOTT COVID  COVID GOLD
1277207639961804800,2020-06-28 11:50:05,936941108487057408, Blockchain expands  advertising industry but Crypto remains    Bitcoin BTC cryptocurrency ETH Ethereum price money trading DeFi FinTech analysis XRP LTC XMR BCH BNB BSV tech bullish mining Gold 
1277206299059634183,2020-06-28 11:44:45,369786451, Dollar Price Percentage Growth Decay  Major Currencies and Gold Since   Jun     
1277206141471244288,2020-06-28 11:44:08,369786451, Dollar Price Percentage Growth Decay  Major Currencies and Gold    Jun     
1277204402709893121,2020-06-28 11:37:13,369786451, Gold Price  Euro Yearly Performance Since   Jun     
1277204213253263361,2020-06-28 11:36:28,369786451, Gold Price   Dollar Yearly Performance Since   Jun     
1277204026468294662,2020-06-28 11:35:43,369786451, Gold Price  IMF SDR  Dollar  Euro British Pound Japanese Yen Chinese Yuan Yearly Performance Since   Jun     
1277203888312135688,2020-06-28 11:35:10,369786451, Gold Price Percentage Growth  Major Currencies and Currency Index    Jun     
1277194165541990400,2020-06-28 10:56:32,1093555573503811584,Price  Gold Fundamental Daily Forecast Rise  COVID   Cases has Investors Betting  More Stimulus Yahoo Finance gold goldnews goldbullion
1277191448115515393,2020-06-28 10:45:44,404815131, Ever considered that GOLD price  leading future inflation      months  the same way that stocks are leading the recovery perhaps over optimistically      months GOLD   hedge against loss  faith  central banking Low rates are  huge boost  GOLD Finance
1277187527464673281,2020-06-28 10:30:10,1158082361646620674,Let  tell you something The gold price was       USD per             UTC goldprice gold price quote 
1277182954272223233,2020-06-28 10:11:59,950281584543870977,The next  mining boom IMO will  huge and due   decoupling from China Let the metal price rises begin Gold   brainer and maybe copper  run  
1277179960457867265,2020-06-28 10:00:06,936941108487057408, Bitcoin price bounce      support shows traders keep buying the dip BTC Crypto ETH cryptocurrency Ethereum cryptonews DeFi XRP trading gold fintech LTC BCH BSV XMR ADA cardano Blockchain 
1277178150762409984,2020-06-28 09:52:54,894834849692884992,Labrador Gold announces  closed previously announced non brokered private placement        units   price        for gross proceeds  LabGold        Gold Mining Exploration 
1277165978183299072,2020-06-28 09:04:32,125709367,Current Silver spot price     silver gold silverprice goldprice            
1277161330953170944,2020-06-28 08:46:04,1093555573503811584,FTSE investors Can the gold price reach  new record high  July Yahoo Finance  gold goldnews goldbullion
1277142798727352321,2020-06-28 07:32:26,2275006482,PamyBot forex fxDailyFX Gold prices are poised  mark  third weekly advance but keeps price below multi year uptrend resistance Here are the levels that matter  XAUUSD technical chart Get your metals update from MBForex here 
1277142793035669504,2020-06-28 07:32:24,2275006482,PamyBot forex fxDailyFX Gold prices continue  have   within its sights  the precious metal hovers around    year high Get your XAUUSD market update from JMcQueenFX here 
1277119545174568960,2020-06-28 06:00:01,827530786253344773,The Price  Gold  Moving Fast AVATRADE itisis avatrade italy italian exclusive trade real international gold play bitcoin cryptocurrency digitalmarketing love essentials gaming billionaire greatness amp amp 
1277119370850758657,2020-06-28 05:59:20,824745484950450177,After momentary correction gold price  ready  attack     and higher analysts GLD EDZ gold GLD EDZ
1277106954989527040,2020-06-28 05:10:00,43855487, Gold price  likely  gain  least   this calendar year  intermittent demand from institutional investors and safe haven buying from retail consumers goldprices 
1277101427618246657,2020-06-28 04:48:02,1093555573503811584,Price  Gold Fundamental Daily Forecast Rise  COVID   Cases has Investors Betting  More Stimulus  Empire gold goldnews goldbullion
1277089023723319297,2020-06-28 03:58:45,41386160,Gold Completes Another Washout Rotation Let  explain our thinking   explore this price pattern  bit further  GLD IAU GDX GDXJ silver preciousmetals stocks gold covid  investing
1277081736141328384,2020-06-28 03:29:47,141723614, nifty banknifty silver gold crude  Based Carlyle Buys   Stake  Piramal Enterprises Pharma Business For Over      Crore PEL Very volatile amp master  price action Stock Jio leader AKASH  
1277081521464266752,2020-06-28 03:28:56,141723614, nifty banknifty silver gold crude  Based Carlyle Buys   Stake  Piramal Enterprises Pharma Business For Over      Crore PEL Very volatile amp master  price action Stock Jio 
1277081379717574656,2020-06-28 03:28:22,141723614, nifty banknifty silver gold crude  Based Carlyle Buys   Stake  Piramal Enterprises Pharma Business For Over      Crore PEL Very volatile amp master  price action Stock Jio leader AKASH AMBANI father  law  PIRAMAL
1277075005034033152,2020-06-28 03:03:02,125709367,Current Silver spot price     silver gold silverprice goldprice            
1277071382279528448,2020-06-28 02:48:39,713713802483773440, balloon gold latipinna molly poecilia sailfin fishfoods Gold Sailfin Balloon Molly Price starts from     GBP 
1277054315874545665,2020-06-28 01:40:50,1273636671095926784, Gold price hit   years high     will     RGL will  supported and reach   soon 
1277040901739565057,2020-06-28 00:47:31,929173416417959936, What  that now about   LvL and  have  run    minimum   possibility  quality gold stocks could     price from here Gold     amp Silver   OMFG ASX MoonShot BullMkt NCM NST EVN RMS SLR 
1277034767670788102,2020-06-28 00:23:09,1208258174526087168,Vir Jewels        cttw   Diamond Stud Earrings White Gold Price price with discount    cttw diamond earrings gold jewels stud vir white 
1277029579576639488,2020-06-28 00:02:32,125709367,Current Silver spot price     silver gold silverprice goldprice            
1277010073735303169,2020-06-27 22:45:01,23074277, Gold prices are poised  mark  third weekly advance but keeps price below multi year uptrend resistance Here are the levels that matter  XAUUSD technical chart Get your metals update from here 
1277003487365210123,2020-06-27 22:18:51,1213829468009066498,Volatility and correlation measures show Bitcoin advancing   digital version  gold and regaining  relative price appreciation advantage 
1276978000643321857,2020-06-27 20:37:35,145535271, Gold price hits fresh record high  Telugu  News 
1276976904499847168,2020-06-27 20:33:13,44408295,This Chart Shows Over   Years  Gold and Silver Prices via HowMuchDataViz gold silver price timeline
1276972725173547008,2020-06-27 20:16:37,2593027459, world wide society called corona once every   years    should  kept  mind that gold prices  not apply  past price transition analysis  common sense 
