Tweet_Id,Time_Of_Tweet,User_ID,Tweet_Text
1278030541808300032,2020-06-30 18:20:00,1249626263435632640, Gold  currently   high level  the short term and the market  night  small  you want  grasp  you can short  near the current price    add short positions    stop loss    and hold  small middle line  see the target    XAUUSD
1278028972425707520,2020-06-30 18:13:46,835110620429234180, the classic   Martin Scorsese movie Casino Robert  Niro wearing  Bueche Girod    tri colors  gold white rose and yellow Price tag       USD Watch reference   Robert  Niro Bueche Girod   Gold Movie 
1278027507439218688,2020-06-30 18:07:57,48728926,The spot gold price from has gone down through     toz        toz goldprice chart Sign  and get free email alerts when the spot price hits your chosen values 
1278025526700097536,2020-06-30 18:00:04,1135674618222645248, Daily Price Update GOLD     USD SILVER     USD GOLD SILVER RATIO     
1278024655643774977,2020-06-30 17:56:37,314612404,Our Executive Chairman Peter Marrone shared his views  global macroeconomic factors that support  higher gold price and why investors should include gold equities  their portfolio  gold mining
1278024220610572295,2020-06-30 17:54:53,85016689, appears that many people are accumulating  dips  the gold price Textbook bull market behavior 
1278022929905782788,2020-06-30 17:49:45,27652717,Gold Price Analysis XAU USD steadies above     after surging  fresh multi year highs  Gold XAUUSD
1278019796395835392,2020-06-30 17:37:18,70641893,New York Comex Gold Price Close     USD per              EDT 
1278019292697518080,2020-06-30 17:35:18,764222802, ONVO doubled   month April  May below dollar per share price Anyway Disclaimer does not constitute financial advice and   investing money gold TrendingNow
1278018355492990978,2020-06-30 17:31:35,837881019105755136, sir You told that     you have funds invest  GOLD and hold   mid   today mid over what  your call  Gold now Did  purchase     wait   down GOLD goldschmidt  Price
1278018052311769088,2020-06-30 17:30:22,472488467,New York Comex Gold Price Close     USD per              EDT
1278017896132653058,2020-06-30 17:29:45,115519210,Going LIVE  one minute Join  SUPPORT AND RESISTANCE PRICE  GOLD BEFORE  RESET  amp  with Lynette Zang GoldPrice Gold 
1278016678874411010,2020-06-30 17:24:55,219142329,Gold heading for largest quarterly price gain since   gold investing markets 
1278016603221721089,2020-06-30 17:24:37,152024685,CHARTS Precious Metals Rally Continues GOLD price soars above   for the first time   decade SILVER also looks good but watch   resistance which looms     area Our top ranked gold silver mining stocks are  big  more upside likely ahead 
1278015514757996546,2020-06-30 17:20:17,1141947500846354432, Gold price 
1278013940094640129,2020-06-30 17:14:02,125649006,Supply and demand economics would suggest that  demand outweighs the supply   product the price will increase until such time  demand tapers Gold PreciousMetals
1278012573527339011,2020-06-30 17:08:36,86693313,Click below  see  weekly Gold price prediction  the Pynk Beta Comment below  tell  your prediction CrowdWisdom XAUUSD XAU  Fintech artificialintelligence via 
1278010691342012417,2020-06-30 17:01:07,1089353599501492225,Gold price        USD gold 
1278010554913783809,2020-06-30 17:00:35,1257781754041155587, Gold running into  price rail  obviously ain  following the path    least resistance 
1278010365931069440,2020-06-30 16:59:50,552009008, Gold   essential part  the asset allocation process Due  its dual nature   consumer good and investment gold  long term price trend  supported  income growth but  the short term its price tends  rise during periods  uncertainty 
1278004677926367232,2020-06-30 16:37:14,1172473272509841408,Click below  see  weekly Gold price prediction  the Pynk Beta Comment below  tell  your prediction CrowdWisdom XAUUSD XAU  Fintech artificialintelligence via 
1278004098432974848,2020-06-30 16:34:55,1868735647, Gold Price Forecast Technical And Fundamental Triggers markets
1277999194985254916,2020-06-30 16:15:26,820982287890157568,    GLD GOLD MON JUNE                    
1277996419278872578,2020-06-30 16:04:25,142691943, the spot price  gold amp silver bullion influencing the bullion amp bullion impacted sectors  the coin market the only way appears    for the collectible scarce  rare amp even the commemorative coin segments  the market via Numismatic News 
1277995507932069890,2020-06-30 16:00:47,87971562, the gold price breakout occurring Tradition says that   confirmed the price must close for three consecutive days above the previous high Close but not there yet   keeping  eye   
1277994194771083265,2020-06-30 15:55:34,19772589,Futures contracts  gold itself just peaked   shy 
1277991634660134913,2020-06-30 15:45:24,1036018569711169537,SHOW  THAT GOLD MONEY BABY GOLD   NEW HIGH CONGRATS  ALL THE GOLD BUGS New mining exploration BULL will  starting here equities are lagging hard against spot gold price   coming  year end Stocks GoldStocks Gold TSXV   GLD ALO GDX 
1277990539229646850,2020-06-30 15:41:03,928263432633233409,GOLD PRICE GOING        the Most violent bull market around the corner Buy physical Gold store for Free amp resell with   commission GOLD SILVER GOLDAVENUE PAMP SWITZERLAND USDollar XAUUSD COVID  
1277990417645080576,2020-06-30 15:40:34,800629853099696128, Gold  the cusp  another major breakout after the yellow metal rallied  its highest trading level since late October   last week 
1277990095778222081,2020-06-30 15:39:17,1220637846824005632, The increase  the price  gold  due  the news  the review  Hongkong security bill The behavior  gold  highly dependent  the tensions between the Chinese government and the UnitedStates Gold USD CNY
1277989839393165313,2020-06-30 15:38:16,713089533538078721, Gold  flashing some signs    sight 
1277987025703112704,2020-06-30 15:27:05,826204568463798273,Gold price Have  look gold recession qeinfinity
1277986353230348289,2020-06-30 15:24:25,106250623, Bitcoin whale moves     BTC Twelve reasons   bullish  BTC long term   price target for     billion fake gold scandal  FCA lifts Wirecard restrictions crypto news and more 
1277986104776351745,2020-06-30 15:23:25,341181460, gold  doing exactly  expected and everyone  loosing their mind hysterical Keep  eye  reversal once price reaches top  the channel     expect  strong correction 
1277985245061681160,2020-06-30 15:20:00,898142955038543873, And    not easy  get physical GOLD  least without large premium gold miners with their reserves provide nice exposure and leverage  the gold price for the months and years  come gdx nem gold  paas
1277984982888255489,2020-06-30 15:18:58,59540061,Gold and Silver catching  Big Bid  the upside  some point THEY will release  and Allow true price discovery PPT Gold Silver 
1277984956581625858,2020-06-30 15:18:52,48728926,The spot gold price from has gone  through     toz        toz goldprice chart Sign  and get free email alerts when the spot price hits your chosen values 
1277983911058919424,2020-06-30 15:14:42,1173879793730953216,Click below  see  weekly Gold price prediction  the Pynk Beta Comment below  tell  your prediction CrowdWisdom XAUUSD XAU  Fintech artificialintelligence via 
1277981974582484992,2020-06-30 15:07:01,1119773744023707649, GDX breaking out  strong momentum price action  the upper Bollinger Band daily charts GDXJ GLD Gold 
1277980303286398978,2020-06-30 15:00:22,472488467,London amp Zurich Gold Price Close     USD per              CEST
1277979888499126277,2020-06-30 14:58:43,1080276696,That goldprice today though   going  reach    the end  the day    keeping  eye   and you can too with our live price charts for gold silver platinum and more Charts 
1277979759360630785,2020-06-30 14:58:13,892369911862972417,Anyone want  share their price predictions for GOLD GLD GOLD Holding some physical precious metals Been debating  liquidation SLV SILVER SILVER 
1277976646373367816,2020-06-30 14:45:50,48728926,The spot gold price from has gone  through     toz        toz goldprice chart Sign  and get free email alerts when the spot price hits your chosen values 
1277976646352400386,2020-06-30 14:45:50,48729501,The spot gold price from has gone  through     toz        toz goldprice chart Sign  and get free email alerts when the spot price hits your chosen values 
1277976646251757568,2020-06-30 14:45:50,48729354,The spot gold price from has gone  through     toz        toz goldprice chart Sign  and get free email alerts when the spot price hits your chosen values 
1277975895664291846,2020-06-30 14:42:51,748957121560121344,Gold prices are breaking out   fresh eight year high Recently its trading   per ounce the highest price since   gold GLD
1277974101034844172,2020-06-30 14:35:43,58446532,The spot gold price from has gone  through     toz        toz goldprice chart Sign  and get free email alerts when the spot price hits your chosen values 
1277973236043534336,2020-06-30 14:32:17,930613821772742657,Gold price volatility has  emerged What does the future look like for gold prices Gold Volatility Markets Trading Broker Economy      retail investor accounts lose money 
1277971562084220935,2020-06-30 14:25:38,1381341090,How long  you think  will take before the price  one Bitcoin  higher than   the price   ounce  gold 
1277971090015313920,2020-06-30 14:23:46,986994378433531904,The last time Bitcoin  price overtook the price   ounce  gold  never looked back 
1277969281259409409,2020-06-30 14:16:34,48728926,The spot gold price from has gone  through     toz        toz goldprice chart Sign  and get free email alerts when the spot price hits your chosen values 
1277968420617646084,2020-06-30 14:13:09,1055427799618674688, GBR Share price QUADRUPLED   year CEO says there   lot more  come The unconventional strategy that everyone doubted including banks has worked exceptionally Watch here Subscribe  Gold TSXV 
1277967582155247618,2020-06-30 14:09:49,56562803,How long  you think  will take before the price   ounce  gold  higher than the price  one Bitcoin 
1277964596591030273,2020-06-30 13:57:57,58446532,The spot gold price from has gone  through     toz        toz goldprice chart Sign  and get free email alerts when the spot price hits your chosen values 
1277962517352902656,2020-06-30 13:49:42,27652717,Gold Price Analysis Bullish spring board opens door  higher targets Confluence Detector  Gold XAUUSD
1277960078998614016,2020-06-30 13:40:00,19772589,Price  gold marks strongest half year since      world stocks   crude oil   silver flat and worst yet  come  Covid  crisis 
1277952948828606464,2020-06-30 13:11:40,58446532,The spot gold price from has gone down through     toz        toz goldprice chart Sign  and get free email alerts when the spot price hits your chosen values 
1277952715944079360,2020-06-30 13:10:45,845556696,Global investors and traders are fearful  the  markets massive parabolic upside price move and are actively hedging  gold and silver according   piece put out  Friday 
1277951397095407618,2020-06-30 13:05:30,2726345108, RLG RLG  RLGMF The more eyeballs  the      gold deposit     and their drill program  build  this resource the better  should  for the stock price This story  growing important converts and  has legs for miles 
1277948786950713344,2020-06-30 12:55:08,930740951957454848,David Price CEO  Rockfire provides with  update  the Company  drilling programme  its   owned Plateau Gold Project  Queensland after yesterday announcing the successful raising    Watch the video below ROCK 
1277947606950387712,2020-06-30 12:50:27,1140484075158941696, GOLD  got  important level  watch  made yesterday  analysis that   waiting for price   down  the Swap Zone  retest  Afterwards   expecting  push  the upside     important key level Watch Price Action now  the Swap Zone 
1277942569410985986,2020-06-30 12:30:26,2613746809,Commenting  the current gold price Marrone said  appear     uptrend   cycle  believe the all time high for gold was   per     Adjusted for time amp inflation means this  worth over     today   haven  reached record gold yet   opinion 
1277941997534212096,2020-06-30 12:28:09,18027088,Good morning The PreciousMetals are mostly higher  early   trading   calendar features Case Shiller Home Price Index Chicago PMI Consumer Confidence   Expected FedSpeak due from Williams Powell and Kashkari gold silver platinum palladium copper 
1277941660882796544,2020-06-30 12:26:49,70641893,New York Comex Gold Price Open     USD per              EDT 
1277940024936259584,2020-06-30 12:20:19,472488467,New York Comex Gold Price Open     USD per              EDT
1277939937443274752,2020-06-30 12:19:58,1146671398091464704,Citi raises gold price forecast 
1277939912482881536,2020-06-30 12:19:52,787686010176020481, VNS ROCKFIRE Plateau Gold Project Update David Price CEO  updates shareholders  deep drilling developments  the Plateau Gold deposit  Queensland ROCK ROCKFIRE Gold Plateau DeeperDrilling MtWright Read the RNS Watch the VNS 
1277939777753366528,2020-06-30 12:19:20,738318826786299906,Watch Managing Director  GoldMartJewellers  Sangeeta Lalwani live  GOLD SPOT talk about the current jewellery buying trends the uncertainty  global economic markets gold price surges and more 
1277938828494475264,2020-06-30 12:15:34,3881078909, OMI GOLD    today something brewing new BoD NEM NEM Newmont     current share price still under   
1277936602048757762,2020-06-30 12:06:43,3091631219,Click below  see  weekly Gold price prediction  the Pynk Beta Comment below  tell  your prediction CrowdWisdom XAUUSD XAU  Fintech artificialintelligence 
1277935675954745345,2020-06-30 12:03:02,2811966313, XAUUSD GOLD   min All elements being clearly bearish  would  possible for traders  trade only short positions for sale  GOLD USD  long  the price remains well below       USD The sellers bearish objective  set        
1277935379551682560,2020-06-30 12:01:52,1175390348408840194, guess  lot  stop loss orders are put around its above and below  the price will hunt down those stop loss orders Then      entry scenario  that   wait until the timing that the Stop loss orders below have been hunted GOLD XAUUSD
1277934948620529665,2020-06-30 12:00:09,34245009,Gold Price Today Gold jumps    silver zooms      via gold goldprice silver 
1277934542867718145,2020-06-30 11:58:32,125709367,Current Silver spot price     silver gold silverprice goldprice            
1277934094563913730,2020-06-30 11:56:45,1096035827505905664, XAUUSD GOLD   min All elements being clearly bearish  would  possible for traders  trade only short positions for sale  GOLD USD  long  the price 
1277933930306568192,2020-06-30 11:56:06,58446688,The spot gold price from has gone down through     toz        toz goldprice chart Sign  and get free email alerts when the spot price hits your chosen values 
1277933808579379208,2020-06-30 11:55:37,27652717,Gold Price Analysis Edges lower  test   hour SMA support around   area  Gold Commodities Technical Analysis XAUUSD
1277930042354532352,2020-06-30 11:40:39,1001192245,Falling Real Yields Suggest Gold Price Will Continue  Rise GLD 
1277929235076861952,2020-06-30 11:37:27,1184062556547231744,  gold sapphire amp diamond ring added for price info amp photos please click  the link antiques antiquesinuk antiquesireland antiqueshop antique antiquesuk vintage interiordesign vintage vintagehome vintageshop vintagefinds 
1277927190672392193,2020-06-30 11:29:19,1339794553,Big increases  the Fed balance sheet have historically correlated with  increase  the price  gold 
1277925809269899264,2020-06-30 11:23:50,369786451, Gold Silver Ratio Crossed the   All Time High    but retraced all move above closed under        Jun     Gold  Silver Price and Gold Silver Ratio Jun     via 
1277921593742721030,2020-06-30 11:07:05,1055427799618674688, TSX ROXG gold Second gold mine will double production and revenue when will the share price follow High grade with exceptional numbers Subscribe  Watch here 
1277920592105295873,2020-06-30 11:03:06,4048262236,Metal Silver News Gold Bull Market Well Established  Many Currencies  they continue  try  suppress the price  gold  the 
1277920183152259076,2020-06-30 11:01:28,56562803, Will you  saying the same thing  year from now  gold       and Bitcoin       One bitcoin will still  twice the price   ounce  gold and will still have outperformed  over the prior   years 
1277916206457028609,2020-06-30 10:45:40,899661698335944704,GCQ  the active Comex gold future  trading   premium  about    over the spot OTC loco London gold price 
1277907990083821569,2020-06-30 10:13:01,1093555573503811584,Gold Price Analysis  daily close above   critical for  test    Confluence detector FXStreet gold goldnews goldbullion
1277903689991311360,2020-06-30 09:55:56,1233061810363912194,The financial crisis    showed that investors choose gold  provide them with financial cover during uncertain times How will investors react today Commodity Metal Trading Investor Gold MarketCrash Coronavirus Investment
1277900994043658241,2020-06-30 09:45:13,1243270261358628864,The team were delighted  conduct  video interview with David Price CEO  this morning  will publish the interview  soon   has been approved ROCK ROCKFIRE Gold DeeperDrilling Plateau 
1277899051112030208,2020-06-30 09:37:30,1082911859584524289,Although gold price has rallied stocks are lagging Sector not even    levels And juniors are lagging seniors Will move when BIG rotates into sector Then trickle down  mid micro nanocaps Expect some absurd returns coming years gold silver mining exploration 
1277896673243643904,2020-06-30 09:28:03,345403264,DAILY MARKET REPORT Tuesday June     GOLD price   this quarter and headed for  third straight monthly gain  GDP reported the largest drop since   Dollar hovers around last week high Read more markets XAUUSD DXY GBPUSD Oil 
1277896132622860288,2020-06-30 09:25:54,27315828,Want  check out how twitter  affecting XAUUSD Gold  known   strongly influenced  news With this tool you can choose the instrument  which you are interested and see how its price was affected  the tweets  the selected asset forex 
1277895712018235392,2020-06-30 09:24:14,836714960810045440,Today  Gold prices       Knowing that price range changes according  market  prices gold invest 
1277894625152417793,2020-06-30 09:19:55,1216991379705888774, YCT ResQ NEW TRADE INFO  ORDER    SELL USDCHF Entry price     Stop loss   pips Take profit   pips Close Price YCT commodity gold wti brent forex FIFO free signal analysis Want  copy 
1277888556686544897,2020-06-30 08:55:48,1273594742329278464, FOREX GOLD Market report Gold extended its sideways consolidative price moves and remained confined   narrow trading band just below the   level 
1277882093725417473,2020-06-30 08:30:07,1158082361646620674,The goose that laid the golden egg The gold price was       USD per             UTC goldprice gold price quote 
1277879844701794309,2020-06-30 08:21:11,715827440359178241,The price  gold has decreased      reach     per tola  Tuesday Khabarhub Gold Price
1277877509116354560,2020-06-30 08:11:54,817252236346540033,Currently gold  undervalued  there are massive bubbles  asset markets and central banks continue  print money which supports these bubbles This   unsustainable situation and when the bubbles burst the gold price will rise 
1277876221414567936,2020-06-30 08:06:47,377975229, Presenting beautiful Silver ring  Reasonable price Explore Our collection Now Order Call         gemstones gemstonejewelry gemstone gems jewelry jewellery Diamond gold jewelrydesign jewels 
1277875750532714497,2020-06-30 08:04:55,3056204496,Margins for gold mining companies have been expanding and that trend should continue Graphic shows all  sustaining cost AISC grey bars compared  the spot gold price The margins have been widening over the last few years red arrow mines commodities gold Mining 
1277873955001348100,2020-06-30 07:57:47,1268818486068903936,Why govt put huge tax  base price  petrol and diesel respectively petrol diesel cars fuel oil  car    india gas petroleum bmw vintage petrolpump   petrolhead power  petrolstation gasoline gold instagood engine hybrid 
1277873762617053186,2020-06-30 07:57:01,2811966313, XAUUSD GOLD   All elements being clearly bullish  would  possible for traders  trade only long positions  the time  purchase  GOLD USD  long  the price remains well above       USD The buyers bullish objective  set  
1277873451521445889,2020-06-30 07:55:47,70641893,London Gold Price Open     USD per              BST 
1277867825185447936,2020-06-30 07:33:25,1168797080795529218,SELL GOLD NOW CURRENT MARKET PRICE TGT   
1277867454891388930,2020-06-30 07:31:57,1246098738629640193,SELL GOLD NOW CURRENT MARKET PRICE TARGET   STOP LOSS   SHORT SCALPING TRADE TRADE WITH     LOT 
1277867078494502913,2020-06-30 07:30:27,472488467,London Gold Price Open     USD per              BST
1277863228186509312,2020-06-30 07:15:09,2494038163,There  plenty  positive news emerging from  multiple fronts ASX KSN resources ASX Ausbiz mining gold 
1277863218497703937,2020-06-30 07:15:07,1068156401153949696, KAT Gold Blyvoor Gold  looking  breaching the      ounce level according  analysts Blyvoor scoping study utilised  conservative gold price       per ounce 
1277861247048986624,2020-06-30 07:07:17,338957752,Gold spot price stayed within striking distance  the     per ounce  Tuesday morning gold goldprice xag xagusd gld comex
1277861026835374081,2020-06-30 07:06:24,361195202,Genedrive for       Gold Dax   meander toward the next phase  Covid    unpleasant number  shares which experienced enhanced expectation growth are seeing their share price look more vulnerable than  Downing  based Civil Ser 
1277860668616527872,2020-06-30 07:04:59,1008545808, are Presenting lemon quartz Far Faceted Roundelle beads  wholesale price Order Now Call     Website gemstonejewelry gemstones gemstone jewelry jewels gems gold jewelrydesign jewelryaddict Jewar 
1277855041479684099,2020-06-30 06:42:37,58446688,The spot gold price from has gone  through     toz        toz goldprice chart Sign  and get free email alerts when the spot price hits your chosen values 
1277846844996046848,2020-06-30 06:10:03,58812551,The spot gold price from has gone  through     toz        toz goldprice chart Sign  and get free email alerts when the spot price hits your chosen values 
1277846844819886080,2020-06-30 06:10:03,58446532,The spot gold price from has gone  through     toz        toz goldprice chart Sign  and get free email alerts when the spot price hits your chosen values 
1277845921301176321,2020-06-30 06:06:23,70641893,Zurich Gold Price Open     USD per              CEST 
1277844409086816258,2020-06-30 06:00:22,827530786253344773,The Price  Gold  Moving Fast AVATRADE itisis avatrade italy italian exclusive trade real international gold play bitcoin cryptocurrency digitalmarketing love essentials gaming billionaire greatness amp amp 
1277844407228612613,2020-06-30 06:00:22,472488467,Zurich Gold Price Open     USD per              CEST
1277844071797518337,2020-06-30 05:59:02,125709367,Current Silver spot price     silver gold silverprice goldprice            
1277842980158582786,2020-06-30 05:54:42,1270318362191515648,Today  gold and silver price   June   BSK Jewellers Visit the nearest store gold goldkewelry goldjewellery silver goldprice jewellery bskjewellers goldrate warangal khammam karimnagar telangana SouthIndianJewellery IndianJewellery GoldJewellery Diamond 
1277840546376019969,2020-06-30 05:45:02,1093555573503811584,Gold price hovers      per   grams Times  India gold goldnews goldbullion
1277838822810607616,2020-06-30 05:38:11,2938919653,New arrivals Butterfly necklace collection Price     pcs Combo price     pcs Postage   Visit   necklace butterfly gold fashion malaysia butterflynecklace plusone goldnecklace accessories necklacemalaysia fashionstyle 
1277831494355075073,2020-06-30 05:09:03,70641893,Sydney Gold Price Close     USD per              EST 
1277829312062734336,2020-06-30 05:00:23,472488467,Sydney Gold Price Close     USD per              EST
1277826248564256768,2020-06-30 04:48:13,27652717,Gold Price Analysis  daily close above   critical for  test    Confluence detector Gold SupportResistance Recommended RiskAppetite Technical Analysis
1277824428366274560,2020-06-30 04:40:59,70641893,Hong Kong Gold Price Morning Session Close     USD per              HKT 
1277821757500436480,2020-06-30 04:30:22,472488467,Hong Kong Gold Price Morning Session Close     USD per              HKT
1277818616264691712,2020-06-30 04:17:53,1001490017917784064,Before the bull mkt  gold  over there will  shortages   billion investment needed over next   yrs just  keep production  current levels Current gold price not enough  entice that level  spending Peak gold  budding narrative 
1277804639031787520,2020-06-30 03:22:21,51340579,Click below  see  weekly Gold price prediction  the Pynk Beta Comment below  tell  your prediction CrowdWisdom XAUUSD XAU  Fintech artificialintelligence via 
1277803580586553344,2020-06-30 03:18:08,1209041517546889217, india  still  third world country CrudeOil Gold InterestRate wholesale price fall international market will not reflect  Retail Price Economy  totally managed  Government amp fellow business friends Mumbai Pune Delhi Hyderabad Kolkata Bengaluru Chennai
1277800820386394113,2020-06-30 03:07:10,2433277862,Gold Rate  Jaipur Today   June     amp   Carat Gold Price gold goldrate goldprice todaygoldrate todaygoldprice ChineseAppsBlocked 
1277798771909259264,2020-06-30 02:59:02,125709367,Current Silver spot price     silver gold silverprice goldprice            
